<?xml version="1.0" encoding="UTF-8"?>
<dataroot xmlns:od="urn:schemas-microsoft-com:officedata" xmlns:xsi="http://www.w3.org/2001/XMLSchema-instance"  xsi:noNamespaceSchemaLocation="tblSessionEvents.xsd" generated="2026-01-16T06:42:16">
<tblSessionEvents>
<EventID>4</EventID>
<SessionID>1</SessionID>
<Status>Accepted</Status>
</tblSessionEvents>
<tblSessionEvents>
<EventID>5</EventID>
<SessionID>2</SessionID>
<Status>Accepted</Status>
</tblSessionEvents>
<tblSessionEvents>
<EventID>6</EventID>
<SessionID>3</SessionID>
<Status>Accepted</Status>
</tblSessionEvents>
<tblSessionEvents>
<EventID>7</EventID>
<SessionID>2</SessionID>
<Status>Rejected</Status>
</tblSessionEvents>
<tblSessionEvents>
<EventID>8</EventID>
<SessionID>3</SessionID>
<Status>Accepted</Status>
</tblSessionEvents>
<tblSessionEvents>
<EventID>9</EventID>
<SessionID>4</SessionID>
<Status>Accepted</Status>
</tblSessionEvents>
<tblSessionEvents>
<EventID>10</EventID>
<SessionID>2</SessionID>
<Status>Accepted</Status>
</tblSessionEvents>
<tblSessionEvents>
<EventID>10</EventID>
<SessionID>6</SessionID>
<Status>Accepted</Status>
</tblSessionEvents>
<tblSessionEvents>
<EventID>11</EventID>
<SessionID>6</SessionID>
<Status>Accepted</Status>
</tblSessionEvents>
<tblSessionEvents>
<EventID>12</EventID>
<SessionID>5</SessionID>
<Status>Accepted</Status>
</tblSessionEvents>
<tblSessionEvents>
<EventID>13</EventID>
<SessionID>2</SessionID>
<Status>Accepted</Status>
</tblSessionEvents>
<tblSessionEvents>
<EventID>14</EventID>
<SessionID>2</SessionID>
<Status>Accepted</Status>
</tblSessionEvents>
<tblSessionEvents>
<EventID>15</EventID>
<SessionID>4</SessionID>
<Status>Accepted</Status>
</tblSessionEvents>
<tblSessionEvents>
<EventID>15</EventID>
<SessionID>5</SessionID>
<Status>Rejected</Status>
</tblSessionEvents>
<tblSessionEvents>
<EventID>15</EventID>
<SessionID>6</SessionID>
<Status>Rejected</Status>
</tblSessionEvents>
<tblSessionEvents>
<EventID>15</EventID>
<SessionID>8</SessionID>
<Status>Rejected</Status>
</tblSessionEvents>
<tblSessionEvents>
<EventID>15</EventID>
<SessionID>9</SessionID>
<Status>Rejected</Status>
</tblSessionEvents>
<tblSessionEvents>
<EventID>16</EventID>
<SessionID>2</SessionID>
<Status>Rejected</Status>
</tblSessionEvents>
<tblSessionEvents>
<EventID>16</EventID>
<SessionID>4</SessionID>
<Status>Rejected</Status>
</tblSessionEvents>
<tblSessionEvents>
<EventID>17</EventID>
<SessionID>1</SessionID>
<Status>Rejected</Status>
</tblSessionEvents>
<tblSessionEvents>
<EventID>17</EventID>
<SessionID>6</SessionID>
<Status>Rejected</Status>
</tblSessionEvents>
<tblSessionEvents>
<EventID>17</EventID>
<SessionID>10</SessionID>
<Status>Rejected</Status>
</tblSessionEvents>
<tblSessionEvents>
<EventID>18</EventID>
<SessionID>2</SessionID>
<Status>Rejected</Status>
</tblSessionEvents>
<tblSessionEvents>
<EventID>18</EventID>
<SessionID>4</SessionID>
<Status>Rejected</Status>
</tblSessionEvents>
<tblSessionEvents>
<EventID>19</EventID>
<SessionID>1</SessionID>
<Status>Rejected</Status>
</tblSessionEvents>
<tblSessionEvents>
<EventID>19</EventID>
<SessionID>6</SessionID>
<Status>Rejected</Status>
</tblSessionEvents>
<tblSessionEvents>
<EventID>19</EventID>
<SessionID>10</SessionID>
<Status>Rejected</Status>
</tblSessionEvents>
<tblSessionEvents>
<EventID>20</EventID>
<SessionID>2</SessionID>
<Status>Rejected</Status>
</tblSessionEvents>
<tblSessionEvents>
<EventID>20</EventID>
<SessionID>4</SessionID>
<Status>Rejected</Status>
</tblSessionEvents>
<tblSessionEvents>
<EventID>21</EventID>
<SessionID>2</SessionID>
<Status>Rejected</Status>
</tblSessionEvents>
<tblSessionEvents>
<EventID>21</EventID>
<SessionID>4</SessionID>
<Status>Rejected</Status>
</tblSessionEvents>
<tblSessionEvents>
<EventID>22</EventID>
<SessionID>2</SessionID>
<Status>Rejected</Status>
</tblSessionEvents>
<tblSessionEvents>
<EventID>22</EventID>
<SessionID>4</SessionID>
<Status>Rejected</Status>
</tblSessionEvents>
<tblSessionEvents>
<EventID>23</EventID>
<SessionID>2</SessionID>
<Status>Rejected</Status>
</tblSessionEvents>
<tblSessionEvents>
<EventID>23</EventID>
<SessionID>4</SessionID>
<Status>Rejected</Status>
</tblSessionEvents>
<tblSessionEvents>
<EventID>24</EventID>
<SessionID>2</SessionID>
<Status>Rejected</Status>
</tblSessionEvents>
<tblSessionEvents>
<EventID>24</EventID>
<SessionID>3</SessionID>
<Status>Rejected</Status>
</tblSessionEvents>
<tblSessionEvents>
<EventID>25</EventID>
<SessionID>3</SessionID>
<Status>Rejected</Status>
</tblSessionEvents>
<tblSessionEvents>
<EventID>25</EventID>
<SessionID>2</SessionID>
<Status>Rejected</Status>
</tblSessionEvents>
<tblSessionEvents>
<EventID>25</EventID>
<SessionID>11</SessionID>
<Status>Rejected</Status>
</tblSessionEvents>
<tblSessionEvents>
<EventID>26</EventID>
<SessionID>3</SessionID>
<Status>Rejected</Status>
</tblSessionEvents>
<tblSessionEvents>
<EventID>26</EventID>
<SessionID>2</SessionID>
<Status>Rejected</Status>
</tblSessionEvents>
<tblSessionEvents>
<EventID>26</EventID>
<SessionID>11</SessionID>
<Status>Rejected</Status>
</tblSessionEvents>
<tblSessionEvents>
<EventID>9</EventID>
<SessionID>6</SessionID>
<Status>Rejected</Status>
</tblSessionEvents>
<tblSessionEvents>
<EventID>9</EventID>
<SessionID>2</SessionID>
<Status>Rejected</Status>
</tblSessionEvents>
<tblSessionEvents>
<EventID>27</EventID>
<SessionID>5</SessionID>
<Status>Rejected</Status>
</tblSessionEvents>
<tblSessionEvents>
<EventID>27</EventID>
<SessionID>2</SessionID>
<Status>Rejected</Status>
</tblSessionEvents>
<tblSessionEvents>
<EventID>27</EventID>
<SessionID>9</SessionID>
<Status>Rejected</Status>
</tblSessionEvents>
<tblSessionEvents>
<EventID>27</EventID>
<SessionID>4</SessionID>
<Status>Rejected</Status>
</tblSessionEvents>
<tblSessionEvents>
<EventID>28</EventID>
<SessionID>9</SessionID>
<Status>Rejected</Status>
</tblSessionEvents>
<tblSessionEvents>
<EventID>28</EventID>
<SessionID>11</SessionID>
<Status>Rejected</Status>
</tblSessionEvents>
<tblSessionEvents>
<EventID>28</EventID>
<SessionID>8</SessionID>
<Status>Rejected</Status>
</tblSessionEvents>
<tblSessionEvents>
<EventID>28</EventID>
<SessionID>5</SessionID>
<Status>Rejected</Status>
</tblSessionEvents>
<tblSessionEvents>
<EventID>28</EventID>
<SessionID>6</SessionID>
<Status>Rejected</Status>
</tblSessionEvents>
<tblSessionEvents>
<EventID>28</EventID>
<SessionID>12</SessionID>
<Status>Rejected</Status>
</tblSessionEvents>
<tblSessionEvents>
<EventID>29</EventID>
<SessionID>5</SessionID>
<Status>Rejected</Status>
</tblSessionEvents>
<tblSessionEvents>
<EventID>30</EventID>
<SessionID>5</SessionID>
<Status>Rejected</Status>
</tblSessionEvents>
<tblSessionEvents>
<EventID>30</EventID>
<SessionID>9</SessionID>
<Status>Rejected</Status>
</tblSessionEvents>
<tblSessionEvents>
<EventID>30</EventID>
<SessionID>8</SessionID>
<Status>Rejected</Status>
</tblSessionEvents>
<tblSessionEvents>
<EventID>30</EventID>
<SessionID>6</SessionID>
<Status>Rejected</Status>
</tblSessionEvents>
<tblSessionEvents>
<EventID>30</EventID>
<SessionID>2</SessionID>
<Status>Accepted</Status>
</tblSessionEvents>
<tblSessionEvents>
<EventID>31</EventID>
<SessionID>5</SessionID>
<Status>Rejected</Status>
</tblSessionEvents>
<tblSessionEvents>
<EventID>31</EventID>
<SessionID>6</SessionID>
<Status>Rejected</Status>
</tblSessionEvents>
<tblSessionEvents>
<EventID>31</EventID>
<SessionID>4</SessionID>
<Status>Rejected</Status>
</tblSessionEvents>
<tblSessionEvents>
<EventID>31</EventID>
<SessionID>2</SessionID>
<Status>Rejected</Status>
</tblSessionEvents>
<tblSessionEvents>
<EventID>31</EventID>
<SessionID>9</SessionID>
<Status>Rejected</Status>
</tblSessionEvents>
<tblSessionEvents>
<EventID>32</EventID>
<SessionID>9</SessionID>
<Status>Rejected</Status>
</tblSessionEvents>
<tblSessionEvents>
<EventID>32</EventID>
<SessionID>4</SessionID>
<Status>Rejected</Status>
</tblSessionEvents>
<tblSessionEvents>
<EventID>32</EventID>
<SessionID>5</SessionID>
<Status>Rejected</Status>
</tblSessionEvents>
<tblSessionEvents>
<EventID>32</EventID>
<SessionID>6</SessionID>
<Status>Rejected</Status>
</tblSessionEvents>
<tblSessionEvents>
<EventID>32</EventID>
<SessionID>2</SessionID>
<Status>Accepted</Status>
</tblSessionEvents>
<tblSessionEvents>
<EventID>33</EventID>
<SessionID>5</SessionID>
<Status>Rejected</Status>
</tblSessionEvents>
<tblSessionEvents>
<EventID>33</EventID>
<SessionID>6</SessionID>
<Status>Rejected</Status>
</tblSessionEvents>
<tblSessionEvents>
<EventID>33</EventID>
<SessionID>9</SessionID>
<Status>Rejected</Status>
</tblSessionEvents>
<tblSessionEvents>
<EventID>33</EventID>
<SessionID>2</SessionID>
<Status>Rejected</Status>
</tblSessionEvents>
<tblSessionEvents>
<EventID>33</EventID>
<SessionID>8</SessionID>
<Status>Rejected</Status>
</tblSessionEvents>
<tblSessionEvents>
<EventID>33</EventID>
<SessionID>12</SessionID>
<Status>Rejected</Status>
</tblSessionEvents>
<tblSessionEvents>
<EventID>34</EventID>
<SessionID>2</SessionID>
<Status>Rejected</Status>
</tblSessionEvents>
<tblSessionEvents>
<EventID>34</EventID>
<SessionID>4</SessionID>
<Status>Rejected</Status>
</tblSessionEvents>
<tblSessionEvents>
<EventID>34</EventID>
<SessionID>5</SessionID>
<Status>Rejected</Status>
</tblSessionEvents>
<tblSessionEvents>
<EventID>34</EventID>
<SessionID>6</SessionID>
<Status>Rejected</Status>
</tblSessionEvents>
<tblSessionEvents>
<EventID>34</EventID>
<SessionID>9</SessionID>
<Status>Rejected</Status>
</tblSessionEvents>
<tblSessionEvents>
<EventID>30</EventID>
<SessionID>4</SessionID>
<Status>Rejected</Status>
</tblSessionEvents>
<tblSessionEvents>
<EventID>35</EventID>